flagscale/backends/vllm/vllm/model_executor/layers/fused_moe/configs/E=256,N=256,device_name=Device_4000,dtype=int8_w8a8.json
{
    "1": {
        "stage1": {
            "BLOCK_SIZE_M": 16,
            "BLOCK_SIZE_N": 64,
            "BLOCK_SIZE_K": 256,
            "GROUP_SIZE_M": 1,
            "num_warps": 4,
            "num_stages": 3,
            "pipeline": "cpasync",
            "scenario": "unroll"
        },
        "stage2": {
            "BLOCK_SIZE_M": 16,
            "BLOCK_SIZE_N": 128,
            "BLOCK_SIZE_K": 64,
            "GROUP_SIZE_M": 16,
            "num_warps": 4,
            "num_stages": 4,
            "pipeline": "cpasync",
            "scenario": "unroll"
        }
    },
    "2": {
        "stage1": {
            "BLOCK_SIZE_M": 16,
            "BLOCK_SIZE_N": 64,
            "BLOCK_SIZE_K": 256,
            "GROUP_SIZE_M": 64,
            "num_warps": 4,
            "num_stages": 3,
            "pipeline": "cpasync",
            "scenario": "unroll"
        },
        "stage2": {
            "BLOCK_SIZE_M": 16,
            "BLOCK_SIZE_N": 256,
            "BLOCK_SIZE_K": 32,
            "GROUP_SIZE_M": 64,
            "num_warps": 4,
            "num_stages": 3,
            "pipeline": "basic",
            "scenario": ""
        }
    },
    "4": {
        "stage1": {
            "BLOCK_SIZE_M": 16,
            "BLOCK_SIZE_N": 64,
            "BLOCK_SIZE_K": 256,
            "GROUP_SIZE_M": 16,
            "num_warps": 4,
            "num_stages": 3,
            "pipeline": "cpasync",
            "scenario": "unroll"
        },
        "stage2": {
            "BLOCK_SIZE_M": 16,
            "BLOCK_SIZE_N": 128,
            "BLOCK_SIZE_K": 64,
            "GROUP_SIZE_M": 64,
            "num_warps": 4,
            "num_stages": 4,
            "pipeline": "cpasync",
            "scenario": ""
        }
    },
    "8": {
        "stage1": {
            "BLOCK_SIZE_M": 16,
            "BLOCK_SIZE_N": 64,
            "BLOCK_SIZE_K": 256,
            "GROUP_SIZE_M": 16,
            "num_warps": 4,
            "num_stages": 3,
            "pipeline": "cpasync",
            "scenario": ""
        },
        "stage2": {
            "BLOCK_SIZE_M": 16,
            "BLOCK_SIZE_N": 128,
            "BLOCK_SIZE_K": 64,
            "GROUP_SIZE_M": 64,
            "num_warps": 4,
            "num_stages": 4,
            "pipeline": "cpasync",
            "scenario": ""
        }
    },
    "16": {
        "stage1": {
            "BLOCK_SIZE_M": 16,
            "BLOCK_SIZE_N": 64,
            "BLOCK_SIZE_K": 256,
            "GROUP_SIZE_M": 1,
            "num_warps": 4,
            "num_stages": 3,
            "pipeline": "cpasync",
            "scenario": ""
        },
        "stage2": {
            "BLOCK_SIZE_M": 16,
            "BLOCK_SIZE_N": 128,
            "BLOCK_SIZE_K": 64,
            "GROUP_SIZE_M": 64,
            "num_warps": 4,
            "num_stages": 3,
            "pipeline": "cpasync",
            "scenario": ""
        }
    },
    "24": {
        "stage1": {
            "BLOCK_SIZE_M": 16,
            "BLOCK_SIZE_N": 64,
            "BLOCK_SIZE_K": 128,
            "GROUP_SIZE_M": 1,
            "num_warps": 4,
            "num_stages": 3,
            "pipeline": "basic",
            "scenario": ""
        },
        "stage2": {
            "BLOCK_SIZE_M": 16,
            "BLOCK_SIZE_N": 128,
            "BLOCK_SIZE_K": 64,
            "GROUP_SIZE_M": 64,
            "num_warps": 4,
            "num_stages": 4,
            "pipeline": "cpasync",
            "scenario": "unroll"
        }
    },
    "32": {
        "stage1": {
            "BLOCK_SIZE_M": 16,
            "BLOCK_SIZE_N": 64,
            "BLOCK_SIZE_K": 256,
            "GROUP_SIZE_M": 1,
            "num_warps": 4,
            "num_stages": 3,
            "pipeline": "cpasync",
            "scenario": ""
        },
        "stage2": {
            "BLOCK_SIZE_M": 16,
            "BLOCK_SIZE_N": 128,
            "BLOCK_SIZE_K": 64,
            "GROUP_SIZE_M": 64,
            "num_warps": 4,
            "num_stages": 4,
            "pipeline": "cpasync",
            "scenario": ""
        }
    },
    "48": {
        "stage1": {
            "BLOCK_SIZE_M": 16,
            "BLOCK_SIZE_N": 64,
            "BLOCK_SIZE_K": 128,
            "GROUP_SIZE_M": 1,
            "num_warps": 4,
            "num_stages": 3,
            "pipeline": "basic",
            "scenario": ""
        },
        "stage2": {
            "BLOCK_SIZE_M": 16,
            "BLOCK_SIZE_N": 128,
            "BLOCK_SIZE_K": 64,
            "GROUP_SIZE_M": 64,
            "num_warps": 4,
            "num_stages": 4,
            "pipeline": "cpasync",
            "scenario": "unroll"
        }
    },
    "64": {
        "stage1": {
            "BLOCK_SIZE_M": 16,
            "BLOCK_SIZE_N": 64,
            "BLOCK_SIZE_K": 128,
            "GROUP_SIZE_M": 1,
            "num_warps": 4,
            "num_stages": 3,
            "pipeline": "basic",
            "scenario": ""
        },
        "stage2": {
            "BLOCK_SIZE_M": 16,
            "BLOCK_SIZE_N": 128,
            "BLOCK_SIZE_K": 64,
            "GROUP_SIZE_M": 64,
            "num_warps": 4,
            "num_stages": 4,
            "pipeline": "cpasync",
            "scenario": "unroll"
        }
    },
    "96": {
        "stage1": {
            "BLOCK_SIZE_M": 16,
            "BLOCK_SIZE_N": 64,
            "BLOCK_SIZE_K": 256,
            "GROUP_SIZE_M": 1,
            "num_warps": 4,
            "num_stages": 3,
            "pipeline": "cpasync",
            "scenario": "unroll"
        },
        "stage2": {
            "BLOCK_SIZE_M": 16,
            "BLOCK_SIZE_N": 128,
            "BLOCK_SIZE_K": 64,
            "GROUP_SIZE_M": 64,
            "num_warps": 4,
            "num_stages": 4,
            "pipeline": "cpasync",
            "scenario": "unroll"
        }
    },
    "128": {
        "stage1": {
            "BLOCK_SIZE_M": 16,
            "BLOCK_SIZE_N": 64,
            "BLOCK_SIZE_K": 256,
            "GROUP_SIZE_M": 1,
            "num_warps": 4,
            "num_stages": 3,
            "pipeline": "cpasync",
            "scenario": ""
        },
        "stage2": {
            "BLOCK_SIZE_M": 16,
            "BLOCK_SIZE_N": 128,
            "BLOCK_SIZE_K": 64,
            "GROUP_SIZE_M": 64,
            "num_warps": 4,
            "num_stages": 4,
            "pipeline": "cpasync",
            "scenario": "unroll"
        }
    },
    "256": {
        "stage1": {
            "BLOCK_SIZE_M": 16,
            "BLOCK_SIZE_N": 64,
            "BLOCK_SIZE_K": 256,
            "GROUP_SIZE_M": 1,
            "num_warps": 4,
            "num_stages": 3,
            "pipeline": "cpasync",
            "scenario": ""
        },
        "stage2": {
            "BLOCK_SIZE_M": 16,
            "BLOCK_SIZE_N": 128,
            "BLOCK_SIZE_K": 64,
            "GROUP_SIZE_M": 32,
            "num_warps": 4,
            "num_stages": 4,
            "pipeline": "cpasync",
            "scenario": "unroll"
        }
    },
    "512": {
        "stage1": {
            "BLOCK_SIZE_M": 32,
            "BLOCK_SIZE_N": 64,
            "BLOCK_SIZE_K": 128,
            "GROUP_SIZE_M": 32,
            "num_warps": 4,
            "num_stages": 4,
            "pipeline": "cpasync",
            "scenario": "unroll"
        },
        "stage2": {
            "BLOCK_SIZE_M": 32,
            "BLOCK_SIZE_N": 128,
            "BLOCK_SIZE_K": 64,
            "GROUP_SIZE_M": 16,
            "num_warps": 4,
            "num_stages": 3,
            "pipeline": "cpasync",
            "scenario": ""
        }
    },
    "1024": {
        "stage1": {
            "BLOCK_SIZE_M": 32,
            "BLOCK_SIZE_N": 128,
            "BLOCK_SIZE_K": 128,
            "GROUP_SIZE_M": 1,
            "num_warps": 8,
            "num_stages": 3,
            "pipeline": "cpasync",
            "scenario": ""
        },
        "stage2": {
            "BLOCK_SIZE_M": 32,
            "BLOCK_SIZE_N": 128,
            "BLOCK_SIZE_K": 64,
            "GROUP_SIZE_M": 16,
            "num_warps": 4,
            "num_stages": 4,
            "pipeline": "cpasync",
            "scenario": ""
        }
    },
    "1536": {
        "stage1": {
            "BLOCK_SIZE_M": 64,
            "BLOCK_SIZE_N": 64,
            "BLOCK_SIZE_K": 128,
            "GROUP_SIZE_M": 1,
            "num_warps": 8,
            "num_stages": 3,
            "pipeline": "basic",
            "scenario": ""
        },
        "stage2": {
            "BLOCK_SIZE_M": 64,
            "BLOCK_SIZE_N": 128,
            "BLOCK_SIZE_K": 64,
            "GROUP_SIZE_M": 1,
            "num_warps": 4,
            "num_stages": 4,
            "pipeline": "cpasync",
            "scenario": ""
        }
    },
    "2048": {
        "stage1": {
            "BLOCK_SIZE_M": 128,
            "BLOCK_SIZE_N": 128,
            "BLOCK_SIZE_K": 128,
            "GROUP_SIZE_M": 1,
            "num_warps": 4,
            "num_stages": 4,
            "pipeline": "cpasync",
            "scenario": "unroll;storeCoalesce"
        },
        "stage2": {
            "BLOCK_SIZE_M": 128,
            "BLOCK_SIZE_N": 128,
            "BLOCK_SIZE_K": 128,
            "GROUP_SIZE_M": 1,
            "num_warps": 4,
            "num_stages": 4,
            "pipeline": "cpasync",
            "scenario": "storeCoalesce"
        }
    },
    "3072": {
        "stage1": {
            "BLOCK_SIZE_M": 128,
            "BLOCK_SIZE_N": 128,
            "BLOCK_SIZE_K": 256,
            "GROUP_SIZE_M": 1,
            "num_warps": 4,
            "num_stages": 4,
            "pipeline": "cpasync",
            "scenario": "storeCoalesce"
        },
        "stage2": {
            "BLOCK_SIZE_M": 128,
            "BLOCK_SIZE_N": 128,
            "BLOCK_SIZE_K": 128,
            "GROUP_SIZE_M": 16,
            "num_warps": 4,
            "num_stages": 4,
            "pipeline": "cpasync",
            "scenario": "storeCoalesce"
        }
    },
    "4096": {
        "stage1": {
            "BLOCK_SIZE_M": 128,
            "BLOCK_SIZE_N": 128,
            "BLOCK_SIZE_K": 256,
            "GROUP_SIZE_M": 1,
            "num_warps": 4,
            "num_stages": 4,
            "pipeline": "cpasync",
            "scenario": "storeCoalesce"
        },
        "stage2": {
            "BLOCK_SIZE_M": 128,
            "BLOCK_SIZE_N": 128,
            "BLOCK_SIZE_K": 128,
            "GROUP_SIZE_M": 1,
            "num_warps": 4,
            "num_stages": 4,
            "pipeline": "cpasync",
            "scenario": "storeCoalesce"
        }
    }
}