flagscale/backends/vllm/vllm/model_executor/layers/fused_moe/configs/E=8,N=2048,device_name=Device_4000.json
{
    "1": {
        "BLOCK_SIZE_M": 16,
        "BLOCK_SIZE_N": 32,
        "BLOCK_SIZE_K": 64,
        "GROUP_SIZE_M": 1,
        "num_warps": 4,
        "num_stages": 4
    },
    "2": {
        "BLOCK_SIZE_M": 16,
        "BLOCK_SIZE_N": 64,
        "BLOCK_SIZE_K": 64,
        "GROUP_SIZE_M": 1,
        "num_warps": 8,
        "num_stages": 3
    },
    "4": {
        "BLOCK_SIZE_M": 32,
        "BLOCK_SIZE_N": 64,
        "BLOCK_SIZE_K": 64,
        "GROUP_SIZE_M": 1,
        "num_warps": 8,
        "num_stages": 4
    },
    "8": {
        "BLOCK_SIZE_M": 16,
        "BLOCK_SIZE_N": 32,
        "BLOCK_SIZE_K": 64,
        "GROUP_SIZE_M": 64,
        "num_warps": 4,
        "num_stages": 4
    },
    "10": {
        "BLOCK_SIZE_M": 16,
        "BLOCK_SIZE_N": 32,
        "BLOCK_SIZE_K": 64,
        "GROUP_SIZE_M": 32,
        "num_warps": 4,
        "num_stages": 4
    },
    "16": {
        "BLOCK_SIZE_M": 16,
        "BLOCK_SIZE_N": 32,
        "BLOCK_SIZE_K": 64,
        "GROUP_SIZE_M": 16,
        "num_warps": 4,
        "num_stages": 4
    },
    "20": {
        "BLOCK_SIZE_M": 16,
        "BLOCK_SIZE_N": 32,
        "BLOCK_SIZE_K": 64,
        "GROUP_SIZE_M": 16,
        "num_warps": 4,
        "num_stages": 4
    },
    "24": {
        "BLOCK_SIZE_M": 16,
        "BLOCK_SIZE_N": 32,
        "BLOCK_SIZE_K": 64,
        "GROUP_SIZE_M": 32,
        "num_warps": 4,
        "num_stages": 4
    },
    "32": {
        "BLOCK_SIZE_M": 16,
        "BLOCK_SIZE_N": 32,
        "BLOCK_SIZE_K": 64,
        "GROUP_SIZE_M": 1,
        "num_warps": 4,
        "num_stages": 4
    },
    "48": {
        "BLOCK_SIZE_M": 32,
        "BLOCK_SIZE_N": 32,
        "BLOCK_SIZE_K": 64,
        "GROUP_SIZE_M": 1,
        "num_warps": 4,
        "num_stages": 4
    },
    "50": {
        "BLOCK_SIZE_M": 32,
        "BLOCK_SIZE_N": 32,
        "BLOCK_SIZE_K": 64,
        "GROUP_SIZE_M": 1,
        "num_warps": 4,
        "num_stages": 4
    },
    "64": {
        "BLOCK_SIZE_M": 32,
        "BLOCK_SIZE_N": 32,
        "BLOCK_SIZE_K": 64,
        "GROUP_SIZE_M": 1,
        "num_warps": 4,
        "num_stages": 4
    },
    "70": {
        "BLOCK_SIZE_M": 32,
        "BLOCK_SIZE_N": 32,
        "BLOCK_SIZE_K": 64,
        "GROUP_SIZE_M": 1,
        "num_warps": 4,
        "num_stages": 4
    },
    "80": {
        "BLOCK_SIZE_M": 32,
        "BLOCK_SIZE_N": 32,
        "BLOCK_SIZE_K": 64,
        "GROUP_SIZE_M": 1,
        "num_warps": 4,
        "num_stages": 4
    },
    "96": {
        "BLOCK_SIZE_M": 128,
        "BLOCK_SIZE_N": 256,
        "BLOCK_SIZE_K": 128,
        "GROUP_SIZE_M": 1,
        "num_warps": 8,
        "num_stages": 2
    },
    "128": {
        "BLOCK_SIZE_M": 128,
        "BLOCK_SIZE_N": 256,
        "BLOCK_SIZE_K": 128,
        "GROUP_SIZE_M": 64,
        "num_warps": 8,
        "num_stages": 2
    },
    "160": {
        "BLOCK_SIZE_M": 128,
        "BLOCK_SIZE_N": 32,
        "BLOCK_SIZE_K": 64,
        "GROUP_SIZE_M": 1,
        "num_warps": 4,
        "num_stages": 4
    },
    "256": {
        "BLOCK_SIZE_M": 128,
        "BLOCK_SIZE_N": 64,
        "BLOCK_SIZE_K": 64,
        "GROUP_SIZE_M": 16,
        "num_warps": 4,
        "num_stages": 3
    },
    "512": {
        "BLOCK_SIZE_M": 128,
        "BLOCK_SIZE_N": 128,
        "BLOCK_SIZE_K": 256,
        "GROUP_SIZE_M": 32,
        "num_warps": 4,
        "num_stages": 3
    },
    "800": {
        "BLOCK_SIZE_M": 128,
        "BLOCK_SIZE_N": 64,
        "BLOCK_SIZE_K": 64,
        "GROUP_SIZE_M": 64,
        "num_warps": 4,
        "num_stages": 3
    },
    "900": {
        "BLOCK_SIZE_M": 128,
        "BLOCK_SIZE_N": 64,
        "BLOCK_SIZE_K": 256,
        "GROUP_SIZE_M": 32,
        "num_warps": 8,
        "num_stages": 4
    },
    "1000": {
        "BLOCK_SIZE_M": 128,
        "BLOCK_SIZE_N": 128,
        "BLOCK_SIZE_K": 256,
        "GROUP_SIZE_M": 1,
        "num_warps": 4,
        "num_stages": 4
    },
    "1024": {
        "BLOCK_SIZE_M": 128,
        "BLOCK_SIZE_N": 128,
        "BLOCK_SIZE_K": 64,
        "GROUP_SIZE_M": 1,
        "num_warps": 4,
        "num_stages": 3
    },
    "1536": {
        "BLOCK_SIZE_M": 128,
        "BLOCK_SIZE_N": 32,
        "BLOCK_SIZE_K": 128,
        "GROUP_SIZE_M": 64,
        "num_warps": 8,
        "num_stages": 2
    },
    "2000": {
        "BLOCK_SIZE_M": 128,
        "BLOCK_SIZE_N": 128,
        "BLOCK_SIZE_K": 64,
        "GROUP_SIZE_M": 16,
        "num_warps": 8,
        "num_stages": 2
    },
    "2048": {
        "BLOCK_SIZE_M": 128,
        "BLOCK_SIZE_N": 256,
        "BLOCK_SIZE_K": 256,
        "GROUP_SIZE_M": 32,
        "num_warps": 4,
        "num_stages": 4
    },
    "3072": {
        "BLOCK_SIZE_M": 128,
        "BLOCK_SIZE_N": 32,
        "BLOCK_SIZE_K": 64,
        "GROUP_SIZE_M": 64,
        "num_warps": 8,
        "num_stages": 3
    },
    "3600": {
        "BLOCK_SIZE_M": 128,
        "BLOCK_SIZE_N": 256,
        "BLOCK_SIZE_K": 256,
        "GROUP_SIZE_M": 32,
        "num_warps": 8,
        "num_stages": 3
    },
    "4096": {
        "BLOCK_SIZE_M": 128,
        "BLOCK_SIZE_N": 128,
        "BLOCK_SIZE_K": 256,
        "GROUP_SIZE_M": 32,
        "num_warps": 8,
        "num_stages": 2
    },
    "5000": {
        "BLOCK_SIZE_M": 128,
        "BLOCK_SIZE_N": 64,
        "BLOCK_SIZE_K": 256,
        "GROUP_SIZE_M": 16,
        "num_warps": 4,
        "num_stages": 3
    },
    "10000": {
        "BLOCK_SIZE_M": 128,
        "BLOCK_SIZE_N": 32,
        "BLOCK_SIZE_K": 256,
        "GROUP_SIZE_M": 16,
        "num_warps": 8,
        "num_stages": 2
    },
    "20000": {
        "BLOCK_SIZE_M": 128,
        "BLOCK_SIZE_N": 32,
        "BLOCK_SIZE_K": 128,
        "GROUP_SIZE_M": 16,
        "num_warps": 4,
        "num_stages": 4
    }
}
